{
  "spec_version": "0.1",
  "intent": {
    "message": "Sabah ritüelinin yeni adı: törensel matcha",
    "audience": "Çayyolu'nda yaşayan, kahveye alternatif arayan 25-40 yaş",
    "cta": "Bu hafta tadına bak",
    "platform": "instagram_post_4x5",
    "label": "concept_study"
  },
  "canvas": {
    "w": 1080,
    "h": 1350,
    "unit": "px",
    "background": "brand.cream",
    "safe_area": {
      "top": 120,
      "bottom": 160,
      "side": 72
    }
  },
  "brand_ref": "whisk",
  "grid": {
    "cols": 12,
    "rows": 12,
    "margin": 72,
    "gutter": 24,
    "baseline": 8
  },
  "layers": [
    {
      "id": "photo",
      "type": "image",
      "src": "asset://photo/matcha-bowl-01",
      "fit": "cover",
      "grid": {
        "col": 1,
        "span": 12,
        "row": 1,
        "row_span": 7
      }
    },
    {
      "id": "kicker",
      "type": "text",
      "role": "label",
      "text": "KONSEPT ÇALIŞMASI · ÇAYYOLU",
      "font": "brand.text",
      "size": 24,
      "tracking": 0.12,
      "grid": {
        "col": 1,
        "span": 12,
        "row": 8
      },
      "color": "brand.sky",
      "lang": "tr",
      "weight": 500
    },
    {
      "id": "headline",
      "type": "text",
      "role": "headline",
      "text": "Yavaşla. Çırp. İç.",
      "font": "brand.display",
      "size": 112,
      "line_height": 1,
      "grid": {
        "col": 1,
        "span": 11,
        "row": 9,
        "row_span": 2
      },
      "color": "brand.cocoa",
      "lang": "tr",
      "weight": 500
    },
    {
      "id": "cta",
      "type": "text",
      "role": "cta",
      "text": "Bu hafta tadına bak",
      "font": "brand.text",
      "size": 36,
      "grid": {
        "col": 1,
        "span": 7,
        "row": 11
      },
      "color": "brand.ink",
      "lang": "tr"
    },
    {
      "id": "logo",
      "type": "image",
      "src": "asset://logo",
      "fit": "contain",
      "grid": {
        "col": 9,
        "span": 4,
        "row": 11,
        "row_span": 2
      }
    }
  ],
  "provenance": {
    "assets": [
      {
        "id": "photo/matcha-bowl-01",
        "source": "placeholder — ürün fotoğrafı yok",
        "license": "TBD"
      },
      {
        "id": "logo",
        "source": "https://whiskandmore.com (sitedeki logo)",
        "license": "Marka sahibine ait; izinsiz, yalnızca iç konsept"
      }
    ]
  },
  "rubric": {
    "scores": {},
    "failures": []
  }
}
